{
  "id": "fa-chatgpt-equation-atp-009",
  "description": "Biochemical reaction equation with plus and arrow operators.",
  "text": "PEP + ADP → Pyruvate + ATP",
  "words": [
    "PEP",
    "+",
    "ADP",
    "→",
    "Pyruvate",
    "+",
    "ATP"
  ],
  "expected": "ltr",
  "expectedVisualOrderLeftToRight": [
    1,
    2,
    3,
    4,
    5,
    6,
    7
  ],
  "tags": [
    "fa",
    "chatgpt",
    "medical",
    "biochemical-equation",
    "arrow",
    "real-world"
  ],
  "curation": "user-provided",
  "nativeSpeakerReviewed": false
}
