{
  "id": "fa-chatgpt-active-recall-024",
  "description": "Active recall test question in Persian with clinical lab values and English test names.",
  "text": "یک کودک دارد: Hb 8.5، retic 12%، indirect bilirubin↑، haptoglobin↓، DAT−، splenomegaly، no spherocytes.",
  "words": [
    "یک",
    "کودک",
    "دارد",
    ":",
    "Hb",
    "8.5",
    "،",
    "retic",
    "12",
    "%",
    "،",
    "indirect",
    "bilirubin↑",
    "،",
    "haptoglobin↓",
    "،",
    "DAT",
    "−",
    "،",
    "splenomegaly",
    "،",
    "no",
    "spherocytes",
    "."
  ],
  "expected": "rtl",
  "expectedVisualOrderRightToLeft": [
    1,
    2,
    3,
    4,
    5,
    6,
    7,
    8,
    9,
    10,
    11,
    12,
    13,
    14,
    15,
    16,
    17,
    18,
    19,
    20,
    21,
    22,
    23,
    24
  ],
  "tags": [
    "fa",
    "chatgpt",
    "medical",
    "lab-values",
    "arrows",
    "question",
    "real-world"
  ],
  "curation": "user-provided",
  "nativeSpeakerReviewed": false
}
