{
  "id": "fa-chatgpt-take-home-emoji-014",
  "description": "Summary callout with key emoji and mixed English-Persian takeaway.",
  "text": "🔑 Take-home:",
  "words": [
    "🔑",
    "Take-home",
    ":"
  ],
  "expected": "ltr",
  "expectedVisualOrderLeftToRight": [
    1,
    2,
    3
  ],
  "tags": [
    "fa",
    "chatgpt",
    "emoji-heading",
    "real-world"
  ],
  "curation": "user-provided",
  "nativeSpeakerReviewed": false
}
